宁波富达股份有限公司,SH600724,宁波富达股份有限公司,存续,144524.1071万元人民币,15,2022年报,浙江省宁波市海曙区解放南路208号建设大厦18-19层,91330200704845351P,L(大型),1993-03-22,浙江省,宁波市,余姚市,fuda@fuda.com,zy@fuda.com,330200000029858,增值税一般纳税人,其他股份有限公司（上市）,制造业,电气机械和器材制造业,家用电力器具制造,家用清洁卫生电器具制造,原材料,非金属材料,建筑材料,水泥与混凝土,浙江省余姚市城区南雷南路2号余姚商会大厦1302室,宁波富达电器股份有限公司,Ningbo Fuda Company Limited,实业投资；自营和代理货物和技术的进出口，但国家限定经营或禁止进出口的货物和技术除外；计算机产品设计。（依法须经批准的项目，经相关部门批准后方可开展经营活动）
鲁商福瑞达医药股份有限公司,SH600223,鲁商健康产业发展股份有限公司,在业,101656.8775万元人民币,0,2022年报,-,91370000267156215K,L(大型),1993-04-21,山东省,淄博市,博山区,xzggsw@lshfz.com.cn,lszybgs@163.com,370000018020768,增值税一般纳税人,股份有限公司（上市）,制造业,医药制造业,卫生材料及医药用品制造,卫生材料及医药用品制造,房地产,房地产开发,住宅开发,-,山东省博山经济开发区,"鲁商健康产业发展股份有限公司,
鲁商置业股份有限公司,
山东万杰高科技股份有限公司,
山东淄博万杰实业股份有限公司","Lushang Furida Pharmaceutical Co., Ltd.",一般项目：医学研究和试验发展；化妆品零售；化妆品批发；生物基材料制造；生物基材料销售；生物基材料技术研发；互联网销售（除销售需要许可的商品）；生物化工产品技术研发；技术服务、技术开发、技术咨询、技术交流、技术转让、技术推广；健康咨询服务（不含诊疗服务）；养老服务；护理机构服务（不含医疗服务）；以自有资金从事投资活动。（除依法须经批准的项目外，凭营业执照依法自主开展经营活动）许可项目：药品生产；药品批发；药品互联网信息服务；药品委托生产；药品进出口；药品零售；化妆品生产。（依法须经批准的项目，经相关部门批准后方可开展经营活动，具体经营项目以相关部门批准文件或许可证件为准）
上海临港控股股份有限公司,SH600848,上海临港控股股份有限公司,存续,252248.7004万元人民币,27,2022年报,上海市浦东新区海港大道1515号创晶科技中心T2-8楼,913100001322046892,L(大型),1994-11-24,上海市,上海市,松江区,ir@lingangholding.com,ir@shlingang.com;jinying@shlingang.com;zhangxiaoyan@saic.sh.cn;renggei1206@126.com;saic3c@163.com,310000400099813,增值税一般纳税人,股份有限公司（中外合资、上市）,房地产业,房地产业,房地产开发经营,房地产开发经营,房地产,房地产开发,产业地产,-,上海市松江区莘砖公路668号3层,上海自动化仪表股份有限公司,"Shanghai Lingang HOLDINGS Co., Ltd.",园区投资、开发和经营，自有房屋租赁，投资管理及咨询，科技企业孵化，企业管理咨询，经济信息咨询及服务（除经纪），物业管理，仓储（除危险品）。（涉及许可证管理、专项规定、质检、安检及相关行业资质要求的，需按照国家有关规定取得相应资质或许可后开展经营业务）。【依法须经批准的项目，经相关部门批准后方可开展经营活动】
绿地控股集团股份有限公司,SH600606,绿地控股集团股份有限公司,存续,1405421.8314万元人民币,0,2022年报,-,913100006311370032,L(大型),1992-07-08,上海市,上海市,黄浦区,wanghui@ldjt.com.cn,shjftz@shjftz.com.cn,310000000010224,增值税一般纳税人,其他股份有限公司（上市）,租赁和商务服务业,商务服务业,组织管理服务,投资与资产管理,房地产,房地产开发,住宅开发,-,上海市黄浦区打浦路700号,"上海金丰投资股份有限公司,
绿地控股股份有限公司,
上海嘉丰股份有限公司",Greenland Holdings Corporation Limited,实业投资，房地产开发经营、租赁、置换，住宅及基础设施配套建设，酒店管理，城市轨道交通工程，金融信息服务（不含金融业务），绿化工程，能源领域内的技术服务，汽车销售服务，物业管理。【依法须经批准的项目，经相关部门批准后方可开展经营活动】
北京城建投资发展股份有限公司,SH600266,北京城建投资发展股份有限公司,存续,215469.4195万元人民币,125,2022年报,北京市朝阳区北土城西路11号,91110000633715698D,L(大型),1998-12-30,北京市,北京市,海淀区,info@bucid.com,wanglei@bucid.com,110000005200596,增值税一般纳税人,其他股份有限公司（上市）,租赁和商务服务业,商务服务业,组织管理服务,投资与资产管理,房地产,房地产开发,住宅开发,-,北京市海淀区大柳树富海中心2号楼14层,北京城建股份有限公司,"Beijing Urban Construction Investment & Development Co., Ltd.",房地产开发、销售商品房；投资及投资管理；销售金属材料、木材、建筑材料、机械电器设备；信息咨询（不含中介服务）；环保技术开发、技术服务。（市场主体依法自主选择经营项目，开展经营活动；依法须经批准的项目，经相关部门批准后依批准的内容开展经营活动；不得从事国家和本市产业政策禁止和限制类项目的经营活动。）
上海亚通股份有限公司,SH600692,上海亚通股份有限公司,存续,35176.4064万元人民币,86,2022年报,上海市崇明区城桥镇鳌山路621号,91310000132221817R,M(中型),1993-10-14,上海市,上海市,崇明区,yt69692618@126.com,-,310000000024218,增值税一般纳税人,其他股份有限公司（上市）,交通运输、仓储和邮政业,水上运输业,水上旅客运输,内河旅客运输,房地产,房地产开发,住宅开发,-,崇明县八一路1号,-,"Shanghai Yatong Co., Ltd.",许可项目：房地产开发经营；建筑劳务分包；建设工程施工。（依法须经批准的项目，经相关部门批准后方可开展经营活动，具体经营项目以相关部门批准文件或许可证件为准）一般项目：金属材料销售；机械设备销售；汽车零配件零售；化工产品销售（不含许可类化工产品）；建筑装饰材料销售；木材销售；家具销售；五金产品零售；日用百货销售；汽车零配件批发；五金产品批发；信息咨询服务（不含许可类信息咨询服务）；工程管理服务；房地产经纪；物业管理；市场营销策划；企业形象策划；会议及展览服务；技术服务、技术开发、技术咨询、技术交流、技术转让、技术推广；合同能源管理；光伏设备及元器件销售；新兴能源技术研发；普通机械设备安装服务；机械设备租赁。（除依法须经批准的项目外，凭营业执照依法自主开展经营活动）
天津海泰科技发展股份有限公司,SH600082,天津海泰科技发展股份有限公司,存续,64611.5826万元人民币,-,-,天津市华苑产业区海泰发展五道16号海泰创新基地CC座G七层,91120000732820119B,M(中型),1993-01-05,天津市,天津市,西青区,irm@hitech-develop.com,-,120000000003673,增值税一般纳税人,股份有限公司（上市）,租赁和商务服务业,-,-,-,房地产,房地产开发,产业地产,-,天津新技术产业园区华苑产业区,-,"TianJin Hi-Tech Development Co., Ltd.",向孵化高新技术成果和创业型科技企业、高新技术企业投资并进行产品的开发、生产；土地开发、房地产开发；技术开发、咨询、转让、服务（电子与信息、机电一体化、新材料、生物工程及制药、新能源和节能技术、环境科学和劳动保护、新型建筑材料、仪器仪表的技术及产品）；物业管理；管理信息咨询；商品及物资的批发兼零售；科技产品及技术进出口业务；易货贸易及转口贸易；保税仓储；限分支机构经营：货运（以上范围内国家有专营专项规定的按规定办理）。
卧龙资源集团股份有限公司,SH600173,卧龙地产集团股份有限公司,存续,70050.6244万元人民币,35,2022年报,-,91330000668325921R,L(大型),1993-07-17,浙江省,绍兴市,上虞区,wolong600173@wolong.com,wanghui1@wolong.com;yangjingjing@wolong.com,330000000008831,增值税一般纳税人,其他股份有限公司（上市）,房地产业,房地产业,房地产开发经营,房地产开发经营,房地产,房地产开发,住宅开发,-,浙江省绍兴市上虞区经济开发区,"卧龙地产集团股份有限公司,
浙江卧龙地产股份有限公司,
黑龙江省牡丹江新材料科技股份有限公司,
牡丹江水泥股份有限公司","Wolong Resource Group Co., Ltd.",许可项目：房地产开发经营；建设工程施工；建设工程设计；住宅室内装饰装修（依法须经批准的项目，经相关部门批准后方可开展经营活动，具体经营项目以审批结果为准）。一般项目：工程管理服务；物业管理；建筑材料销售；高性能有色金属及合金材料销售；建筑装饰材料销售；机械设备销售；稀土功能材料销售；货物进出口；金属矿石销售；以自有资金从事投资活动（除依法须经批准的项目外，凭营业执照依法自主开展经营活动）。
深圳华侨城股份有限公司,SZ000069,深圳华侨城股份有限公司,存续,820568.1415万元人民币,0,2022年报,-,91440300279374105B,L(大型),1997-09-02,广东省,深圳市,南山区,000069IR@chinaoct.com,-,440301103282083,一般纳税人,上市股份有限公司,租赁和商务服务业,商务服务业,其他商务服务业,其他未列明商务服务业,房地产,房地产开发,商业地产,-,深圳市南山区华侨城指挥部大楼103、105、107、111、112室,"深圳华侨城控股股份有限公司,
深圳华侨城实业发展股份有限公司","Shenzhen Overseas Chinese Town Co., Ltd.",一般经营项目是：旅游及其关联产业的投资和管理；房地产开发；自有物业租赁；酒店管理；文化活动的组织策划；会展策划；旅游项目策划；旅游信息咨询；旅游工艺品的销售；投资兴办实业（具体项目另行申报）；国内商业（不含专营、专控、专卖商品）；经营进出口业务（法律、行政法规、国务院决定禁止的项目除外，限制的项目须取得许可后方可经营）。
美好置业集团股份有限公司,SZ000667,美好置业集团股份有限公司,存续,246698.8633万元人民币,6,2022年报,-,9153000021665904XL,L(大型),1996-10-17,云南省,昆明市,盘龙区,mhzy@000667.com,lirq@000667.com;ir@000667.com,530000000006503,增值税一般纳税人,股份有限公司（非上市、自然人投资或控股）,租赁和商务服务业,商务服务业,组织管理服务,投资与资产管理,房地产,房地产开发,住宅开发,-,云南省昆明市盘龙区北京路与联盟路交叉口卓越俊园10栋2单元2317室,"名流置业集团股份有限公司,
昆明五华实业（集团）股份有限公司,
云南华一投资集团股份有限公司","Myhome Real Estate Development Group Co., Ltd.",许可项目：房地产开发经营（依法须经批准的项目，经相关部门批准后方可开展经营活动，具体经营项目以相关部门批准文件或许可证件为准）一般项目：企业管理咨询；以自有资金从事投资活动；信息咨询服务（不含许可类信息咨询服务）；住房租赁；非居住房地产租赁；土地使用权租赁（除依法须经批准的项目外，凭营业执照依法自主开展经营活动）。
阳光新业地产股份有限公司,SZ000608,阳光新业地产股份有限公司,存续,74991.3309万元人民币,0,2022年报,深圳市深南东路5016号京基一百大厦A座6901-01A单元,91450000200538358N,M(中型),1996-06-07,广西壮族自治区,南宁市,江南区,yangguangxinye@yangguangxinye.com,yangguangxinye@yangguagnxinye.com,450000400001362,增值税一般纳税人,其他股份有限公司（上市）,房地产业,房地产业,房地产开发经营,房地产开发经营,房地产,房地产开发,商业地产,-,南宁市江南路230号南宁经济技术开发区,"广西阳光股份有限公司,
广西虎威股份有限公司","Yang Guang Co., Ltd.",房地产开发经营；装修装饰工程；自有商品房的租赁；房地产开发的法律、法规和政策的咨询服务；商业管理服务。（法律、法规禁止的项目除外，法律、法规限制的项目取得许可后方可开展经营）（依法须经批准的项目，经相关部门批准后方可开展经营活动。）
广州珠江发展集团股份有限公司,SH600684,广州珠江实业开发股份有限公司,在业,85346.0723万元人民币,161,2022年报,广州市越秀区东风中路362号颐德中心30楼,9144010119048157XD,L(大型),1992-12-23,广东省,广州市,越秀区,gzzjsy@gzzjsy.com,-,440101000083068,增值税一般纳税人,股份有限公司（上市、国有控股）,房地产业,房地产业,房地产开发经营,房地产开发经营,房地产,房地产开发,住宅开发,-,广州市越秀区环市东路371-375号世界贸易中心大厦南塔11楼S1101-05、S1118-24房,"广州珠江实业开发股份有限公司,
广州珠江房产公司,
广州珠江外资建设总公司房产公司","Guangzhou Pearl River Development Group Co., Ltd.",非居住房地产租赁;住房租赁;物业管理;以自有资金从事投资活动;土地使用权租赁;技术服务、技术开发、技术咨询、技术交流、技术转让、技术推广;工程管理服务;工程技术服务（规划管理、勘察、设计、监理除外）;酒店管理;工程和技术研究和试验发展;环保咨询服务;土壤污染治理与修复服务;土壤环境污染防治服务;停车场服务;招投标代理服务;城市绿化管理;会议及展览服务;租赁服务（不含许可类租赁服务）;信息咨询服务（不含许可类信息咨询服务）;体育竞赛组织;社会经济咨询服务;文化场馆管理服务;劳务服务（不含劳务派遣）;房地产开发经营;建设工程施工;高危险性体育运动（游泳）
信达地产股份有限公司,SH600657,信达地产股份有限公司,存续,285187.8595万元人民币,138,2022年报,北京市海淀区中关村南大街甲18号北京国际大A座10层,911100001015301828,L(大型),1984-07-20,北京市,北京市,东城区,zonghebu@cinda.com.cn,zongban_dc@cinda.com.cn;zonghebu_dc@cinda.com.cn,110000001004991,增值税一般纳税人,其他股份有限公司（上市）,房地产业,房地产业,房地产开发经营,房地产开发经营,房地产,房地产开发,住宅开发,-,北京市东城区永内大街1号,"北京天桥北大青鸟科技股份有限公司,
北京市天桥百货股份有限公司","Cinda Real Estate Co., Ltd.",房地产开发；投资及投资管理；物业管理；企业管理咨询；销售建筑材料。（市场主体依法自主选择经营项目，开展经营活动；依法须经批准的项目，经相关部门批准后依批准的内容开展经营活动；不得从事国家和本市产业政策禁止和限制类项目的经营活动。）
中润资源投资股份有限公司,SZ000506,中润资源投资股份有限公司,在业,92901.7761万元人民币,16,2022年报,-,91370000206951100B,L(大型),1988-05-11,山东省,济南市,历下区,1070228474@qq.com,805521184@qq.com;zrky_lq@163.com;zyky_lq@163.com,370000000000068,增值税一般纳税人,其他股份有限公司（上市）,租赁和商务服务业,商务服务业,组织管理服务,投资与资产管理,房地产,房地产开发,住宅开发,-,济南市经十路13777号中润世纪广场17栋,"四川峨眉集团股份有限公司,
四川峨眉山盐化工业（集团）股份有限公司,
山东惠邦地产股份有限公司,
山东中润投资控股集团股份有限公司",Zhongrun Resources Investment Corporation,矿产资源勘探、开发投资；矿产品加工、销售；房屋销售、租赁；公司股权投资。（依法须经批准的项目，经相关部门批准后方可开展经营活动）
广州粤泰集团股份有限公司,SH600393,广州粤泰集团股份有限公司,在业,253624.787万元人民币,88,2022年报,-,914401011906806329,M(中型),1983-06-15,广东省,广州市,越秀区,449149431@qq.com,1815503613@qq.com;28103077@qq.com;1240583124@qq.com;95309204@163.com;372519406@qq.com,440101000086242,增值税一般纳税人,股份有限公司（上市、自然人投资或控股）,房地产业,房地产业,房地产开发经营,房地产开发经营,房地产,房地产开发,住宅开发,-,广州市越秀区寺右新马路170号4楼,"广州东华实业股份有限公司,
广州东华实业公司","Guangzhou Yuetai Group Co., Ltd.",房地产开发经营;房地产中介服务;房地产咨询服务;物业管理;场地租赁（不含仓储）;房屋租赁;自有房地产经营活动;房屋建筑工程施工;企业自有资金投资;商品批发贸易（许可审批类商品除外）;非金属矿及制品批发（国家专营专控类除外）;金属及金属矿批发（国家专营专控类除外）;企业管理咨询服务;园林绿化工程服务;林木育种;林木育苗
万科企业股份有限公司,SZ000002,万科企业股份有限公司,存续,1099521.0218万元人民币,-,-,-,91440300192181490G,L(大型),1984-05-30,广东省,深圳市,盐田区,liufy@vanke.com,dingxh01@vanke.com;huangf@vanke.com;IR@vanke.com;zbfax@vanke.com,440301102900139,一般纳税人,上市股份有限公司,房地产业,房地产业,房地产开发经营,房地产开发经营,房地产,房地产开发,住宅开发,-,深圳市盐田区大梅沙环梅路33号万科中心,"深圳万科企业股份有限公司,
深圳现代企业有限公司","China Vanke Co., Ltd.",一般经营项目是:兴办实业（具体项目另行申报）;国内商业、物资供销业（不含专营、专控、专卖商品）;进出口业务（按深经发审证字第113号外贸企业审定证书规定办理）;房地产开发。
深圳市振业（集团）股份有限公司,SZ000006,深圳市振业(集团)股份有限公司,存续,134999.5046万元人民币,-,-,-,91440300618831041G,L(大型),1989-05-25,广东省,深圳市,罗湖区,zwyanny@qq.com,szzygp@126.com;284878363@qq.com,440301103341062,一般纳税人,上市股份有限公司,房地产业,房地产业,房地产开发经营,房地产开发经营,房地产,房地产开发,住宅开发,-,深圳市罗湖区桂园街道宝安南路2014号振业大厦A座31层,深圳市振业股份有限公司,"Shenzhen Zhenye(Group) Co., Ltd.",一般经营项目是：土地开发、房产销售及租赁、物业管理。
上海实业发展股份有限公司,SH600748,上海实业发展股份有限公司,存续,184456.2892万元人民币,49,2022年报,上海市黄浦区淮海中路98号金钟广场20楼,9131000013227883X9,L(大型),1996-09-19,上海市,上海市,浦东新区,Sid748@sidlgroup.com,-,310000000047164,增值税一般纳税人,股份有限公司（台港澳与境内合资、上市）,房地产业,房地产业,房地产开发经营,房地产开发经营,房地产,房地产开发,住宅开发,-,中国（上海）自由贸易试验区浦东南路1085号,上海浦东不锈薄板股份有限公司,"Shanghai Industrial Development Co., Ltd.",房地产开发、房地产经营、与房地产业务相关的信息咨询服务、国内贸易（上述经营范围不涉及前置审批项目）。【依法须经批准的项目，经相关部门批准后方可开展经营活动】
数源科技股份有限公司,SZ000909,数源科技股份有限公司,存续,45382.86万元人民币,188,2022年报,-,913300007125597931,M(中型),1999-03-31,浙江省,杭州市,西湖区,jsjzx@soyea.com.cn,zhouyp@soyea.com.cn;zuopf@soyea.com.cn,330000000044723,增值税一般纳税人,其他股份有限公司（上市）,制造业,计算机、通信和其他电子设备制造业,非专业视听设备制造,电视机制造,房地产,房地产开发,住宅开发,-,浙江省杭州市西湖区教工路1号,-,"Soyea Technology Co., Ltd.",许可项目：货物进出口（依法须经批准的项目，经相关部门批准后方可开展经营活动，具体经营项目以审批结果为准）。一般项目：电视机制造；家用电器销售；计算机软硬件及外围设备制造；计算机软硬件及辅助设备零售；通信设备制造；通信设备销售；输配电及控制设备制造；通讯设备修理；日用电器修理；电子产品销售；电子元器件批发；电子元器件制造；新能源汽车换电设施销售；汽车零部件及配件制造；智能输配电及控制设备销售；机动车充电销售；分布式交流充电桩销售；集中式快速充电站；软件开发；信息技术咨询服务；技术服务、技术开发、技术咨询、技术交流、技术转让、技术推广；塑料制品制造；模具制造；机械设备租赁；非居住房地产租赁；汽车租赁；物业管理；再生资源回收（除生产性废旧金属）；物联网技术研发；物联网应用服务；智能车载设备制造；物联网设备制造；物联网设备销售；电气信号设备装置销售；信息系统集成服务；安防设备销售；光伏设备及元器件制造；光伏设备及元器件销售；太阳能发电技术服务；配电开关控制设备制造；配电开关控制设备销售；其他电子器件制造；助动车制造；光伏发电设备租赁；智能仓储装备销售；物料搬运装备销售；物料搬运装备制造；电池制造；电池销售；蓄电池租赁；新能源汽车电附件销售；资源再生利用技术研发；机械电气设备制造；工业机器人制造；工业机器人销售；智能机器人的研发；金属材料销售；有色金属合金销售；金属矿石销售（除依法须经批准的项目外，凭营业执照依法自主开展经营活动）。
华丽家族股份有限公司,SH600503,华丽家族股份有限公司,存续,160229万元人民币,72,2022年报,上海市长宁区红宝石路500号东银中心B栋15楼,913100001581638383,S(小型),1996-10-18,上海市,上海市,奉贤区,songjingyun@deluxe-family.com,-,310000000094312,增值税一般纳税人,其他股份有限公司（上市）,金融业,资本市场服务,资本投资服务,资本投资服务,房地产,房地产开发,住宅开发,-,上海市奉贤区星火开发区阳明路1号8幢1层105室,-,"Deluxe Family Co., Ltd.",股权投资管理，实业投资，投资咨询及管理。【依法须经批准的项目，经相关部门批准后方可开展经营活动】
南京栖霞建设股份有限公司,SH600533,南京栖霞建设股份有限公司,在业,105000万元人民币,116,2022年报,南京市栖霞区马群街道仙林大道99号,91320100721702184R,L(大型),1999-12-23,江苏省,南京市,栖霞区,chixia@chixia.com,-,320100000029584,增值税一般纳税人,股份有限公司（上市）,房地产业,房地产业,-,-,房地产,房地产开发,住宅开发,-,南京市栖霞区仙林大道99号8幢,-,"Nanjing Chixia Development Co., Ltd.",住宅小区综合开发建设；商品房销售、租赁、售后服务；投资兴办实业；教育产业投资。（依法须经批准的项目，经相关部门批准后方可开展经营活动）
中天金融集团股份有限公司,SZ000540,中天金融集团股份有限公司,存续,700525.4679万元人民币,170,2022年报,-,91520000214466447K,L(大型),1994-01-08,贵州省,贵阳市,观山湖区,info@ztfgroup.com,191003764@qq.com,520000000014818,-,其他股份有限公司（上市）,房地产业,房地产业,房地产开发经营,房地产开发经营,房地产,房地产开发,住宅开发,-,贵州省贵阳市观山湖区中天路3号,"中天城投集团股份有限公司,
贵州中天（集团）股份有限公司,
世纪中天投资股份有限公司,
中天企业股份有限公司",Zhongtian Financial Group Company Limited,法律、法规、国务院决定规定禁止的不得经营；法律、法规、国务院决定规定应当许可（审批）的，经审批机关批准后凭许可（审批）文件经营;法律、法规、国务院决定规定无需许可（审批）的，市场主体自主选择经营。（金融投资；股权投资；实业投资；资产经营；产业基金、产权市场投资与管理；金融服务及研究；金融企业投资及管理、咨询；城市基础及公共设施投资管理；壹级房地产开发。）
天津天保基建股份有限公司,SZ000965,天津天保基建股份有限公司,存续,110983.0895万元人民币,30,2022年报,-,91120000700597012E,L(大型),1998-09-30,天津市,天津市,东丽区,35162253@qq.com,151012155@qq.com;18664395@qq.com;angel_19930317@126.com;tbjijian@tbjijian.com,120000000000438,增值税一般纳税人,股份有限公司（上市）,建筑业,土木工程建筑业,-,-,房地产,房地产开发,住宅开发,-,天津自贸试验区（空港经济区）西五道35号汇津广场1号楼-602,天津水泥股份有限公司,"Tianjin Tianbao Infrastructure Co., Ltd.",基础设施开发建设、经营；以自有资金对房地产进行投资；商品房销售；房地产中介服务；自有房屋租赁；物业管理；工程项目管理服务（依法须经批准的项目，经相关部门批准后方可开展经营活动）
