金融街控股股份有限公司,SZ000402,金融街控股股份有限公司,存续,298892.9907万元人民币,148,2022年报,-,9111000020283066XF,L(大型),1996-06-18,北京市,北京市,西城区,service@jrjkg.com,cywang@jrjkg.com,110000002625954,增值税一般纳税人,其他股份有限公司（上市）,租赁和商务服务业,商务服务业,组织管理服务,投资与资产管理,房地产,房地产开发,商业地产,-,北京市西城区金城坊街7号,重庆华亚现代纸业股份有限公司,"Financial Street Holdings Co., Ltd.",以下项目仅限分公司经营：住宿、游泳池、网球场、中西餐、冷、热饮、糕点、美容美发、洗浴、零售卷烟、图书期刊；房地产开发，销售商品房；物业管理；新技术及产品项目投资；技术开发；技术服务；技术咨询；停车服务；出租办公用房、商业用房；健身服务；劳务服务；打字；复印；会议服务；技术培训；承办展览展示；饭店管理；餐饮管理；企业形象策划；组织文化交流活动；销售百货、工艺美术品、建筑材料、机械电气设备安装；货物进出口、技术进出口、代理进出口。（市场主体依法自主选择经营项目，开展经营活动；依法须经批准的项目，经相关部门批准后依批准的内容开展经营活动；不得从事国家和本市产业政策禁止和限制类项目的经营活动。）
北京空港科技园区股份有限公司,SH600463,北京空港科技园区股份有限公司,存续,30000万元人民币,81,2022年报,北京市天竺空港经济开发区B区裕民大街甲6号,9111000072260157XJ,L(大型),2000-03-28,北京市,北京市,顺义区,kg600463@163.com,beijing100621@126.com,110000001255214,一般纳税人,其他股份有限公司（上市）,科学研究和技术服务业,科技推广和应用服务业,其他科技推广服务业,其他科技推广服务业,房地产,房地产开发,产业地产,-,北京市顺义区天竺空港工业区A区,-,"Beijing Airport High-Tech Park Co., Ltd.",高新技术的开发、转让和咨询；销售开发后的产品；土地开发，仓储，物业管理，经济信息咨询。（市场主体依法自主选择经营项目，开展经营活动；依法须经批准的项目，经相关部门批准后依批准的内容开展经营活动；不得从事国家和本市产业政策禁止和限制类项目的经营活动。）
泰禾集团股份有限公司,SZ000732,泰禾集团股份有限公司,存续,248890.144万元人民币,0,2022年报,福州市晋安区横屿路9号泰禾中心26层,91350000155584573M,L(大型),1992-12-29,福建省,三明市,三元区,zhangfuxian@tahoecn.com,-,350000100016163,增值税一般纳税人,股份有限公司（上市、自然人投资或控股）,房地产业,房地产业,房地产开发经营,房地产开发经营,房地产,房地产开发,住宅开发,-,三明市梅列区徐碧,"福建三农集团股份有限公司,
福建省三农化学股份有限公司","Tahoe Group Co., Ltd.",房地产开发经营；本公司商标特许经营；酒店管理；物业管理；园林绿化工程的设计、施工；商业物资供销（专营、专控、专卖及专项审批的商品除外）；对外贸易；技术开发及技术转让；对第一产业、第二产业及第三产业的投资及投资管理；营养健康咨询服务；金融信息服务；企业管理咨询。（依法须经批准的项目，经相关部门批准后方可开展经营活动）
上海大名城企业股份有限公司,SH600094,上海大名城企业股份有限公司,存续,247532.5057万元人民币,16,2022年报,上海市长宁区红宝石路500号东银中心B栋29楼,913100006073563962,L(大型),1996-07-18,上海市,上海市,闵行区,dmc@greattown.cn,-,310000400150891,增值税一般纳税人,股份有限公司（中外合资、上市）,房地产业,房地产业,房地产开发经营,房地产开发经营,房地产,房地产开发,住宅开发,-,上海市闵行区红松东路1116号1幢5楼A区,"上海名城实业股份有限公司,
上海华源股份有限公司",Greattown Holdings Ltd.,房地产综合开发，建造、销售商品房；物业管理，物业租赁；公共基础设施开发与建设；建筑装饰安装工程；从事新能源科技领域的技术开发、技术咨询、技术服务、技术转让，新能源汽车的销售；生产、加工、销售生物制品、农药及中间体（限分支机构经营）、药品原料及制剂（限分支机构经营）、保健品（限分支机构经营）、新型建材、包装材料、现代通讯信息新材料及相关器件；上述产品的研究开发、技术咨询和售后服务；经营进出口业务。（涉及配额、许可证或国家专项管理的，应凭证经营或按国家有关规定另行报批）。【依法须经批准的项目，经相关部门批准后方可开展经营活动】
东莞宏远工业区股份有限公司,SZ000573,东莞宏远工业区股份有限公司,在业,63828.0604万元人民币,23,2022年报,-,91441900281825294G,M(中型),1992-05-08,广东省,东莞市,-,office@winnerway.com,0573@21cn.com,441900000597623,增值税一般纳税人,其他股份有限公司（上市）,房地产业,房地产业,-,-,房地产,房地产开发,住宅开发,-,东莞市南城区宏远工业区,-,DongGuan Winnerway Industry Zone Ltd.,开发经营工业区，房地产开发，开办外引内联企业及其咨询、洽谈业务；生产经营高科技产品、五金、交电、建筑装饰材料，技术咨询；原煤开采（另设分支机构经营）。（依法须经批准的项目，经相关部门批准后方可开展经营活动）
大连友谊（集团）股份有限公司,SZ000679,大连友谊(集团)股份有限公司,存续,35640万元人民币,163,2022年报,辽宁省大连市沙河口区星海广场B3区35-4号公建,9121020011831278X6,M(中型),1992-07-28,辽宁省,大连市,中山区,sup911@163.com,-,210200000006827,一般纳税人,其他股份有限公司（上市）,批发和零售业,零售业,-,-,消费,零售,一般零售,多业态零售,辽宁省大连市中山区七一街5号,-,"Dalian Friendship (Group) Co., Ltd.",房地产开发；（以下限分支机构经营）商品零售、酒店、对船供应、进出口贸易、免税商品；农副产品收购；客房写字间出租、会议服务、企业管理服务、广告业务。（依法须经批准的项目，经相关部门批准后方可开展经营活动。）
派斯林数字科技股份有限公司,SH600215,长春经开(集团)股份有限公司,存续,46503.288万元人民币,12,2022年报,-,91220101124067880U,L(大型),1993-06-26,吉林省,长春市,长春经济技术开发区,600215@paslin.cn,ccjk_600215@163.com;ccjk600215@163.com;songzhu.li@wfjyjt.com,220101124067880,-,其他股份有限公司（上市）,租赁和商务服务业,商务服务业,组织管理服务,投资与资产管理,房地产,房地产开发,住宅开发,-,长春市经济开发区南沙大街2888号,"长春经开（集团）股份有限公司,
长春经济技术开发区开发建设（集团）股份有限公司","Paslin Digital Technology Co., Ltd.",一般项目：工业自动控制系统装置制造；工业自动控制系统装置销售；机械电气设备制造；机械电气设备销售；智能控制系统集成；信息系统集成服务；物联网技术服务；工业互联网数据服务；人工智能行业应用系统集成服务；数据处理和存储支持服务；信息技术咨询服务；信息咨询服务（不含许可类信息咨询服务）；技术服务、技术开发、技术咨询、技术交流、技术转让、技术推广；货物进出口；以自有资金从事投资活动。（除依法须经批准的项目外，凭营业执照依法自主开展经营活动）
京能置业股份有限公司,SH600791,京能置业股份有限公司,存续,45288万元人民币,147,2022年报,-,91110000214406620R,L(大型),1997-04-01,北京市,北京市,西城区,710980671@qq.com,fengna@beih-zy.com,110000007977747,一般纳税人,其他股份有限公司（上市）,房地产业,房地产业,房地产开发经营,房地产开发经营,房地产,房地产开发,住宅开发,-,北京市西城区复兴门南大街2号甲天银大厦A西八层,"贵州华联旅业（集团）股份有限公司,
贵州华联（集团）股份有限公司","BEH-PROPERTY Co., Ltd.",房地产开发；房地产信息咨询；投资顾问；销售商品房；高科技项目投资；房屋租赁。（市场主体依法自主选择经营项目，开展经营活动；依法须经批准的项目，经相关部门批准后依批准的内容开展经营活动；不得从事国家和本市产业政策禁止和限制类项目的经营活动。）
海航投资集团股份有限公司,SZ000616,海航投资集团股份有限公司,存续,143023.4425万元人民币,127,2022年报,海南省海口市美兰区国兴大道 7 号新海航大厦19层,91210200241278804K,M(中型),1993-05-27,辽宁省,大连市,中山区,hhtz@hnair.com,jy-wei@hnair.com;htgf@hnair.com;fanlei@hnair.com;ir@yeland.com.cn,210200000261664,一般纳税人,其他股份有限公司（上市）,租赁和商务服务业,商务服务业,组织管理服务,投资与资产管理,房地产,房地产开发,住宅开发,-,辽宁省大连市中山区长江路123号长江写字楼2129,"亿城投资集团股份有限公司,
亿城集团股份有限公司,
大连亿城集团股份有限公司,
大连渤海饭店（集团）股份有限公司","HNA Investment Group Co., Ltd.",项目投资及管理、投资咨询。（ 依法须经批准的项目，经相关部门批准后，方可开展经营活动）
格力地产股份有限公司,SH600185,格力地产股份有限公司,在业,188500.5795万元人民币,29,2022年报,-,91440400628053925E,L(大型),1999-06-09,广东省,珠海市,香洲区,gldc@greedc.com,-,610131100018386,增值税一般纳税人,其他股份有限公司（上市）,房地产业,房地产业,-,-,房地产,房地产开发,住宅开发,-,珠海市横琴新区环岛东路3000号2103办公,"西安格力地产股份有限公司,
西安海星现代科技股份有限公司","Gree Real Estate Co., Ltd.",章程记载的经营范围：实业投资、资产经营、房地产开发经营、物业管理、国内贸易（除专项规定外）、建筑材料的批发、零售、代购代销。（依法须经批准的项目，经相关部门批准后方可开展经营活动）
北京北辰实业股份有限公司,SH601588,北京北辰实业股份有限公司,存续,336702万元人民币,3322,2022年报,-,91110000633791930G,L(大型),1998-10-09,北京市,北京市,朝阳区,northstar@beijingns.com.cn,-,110000410131502,增值税一般纳税人,股份有限公司（台港澳与境内合资、上市）,房地产业,房地产业,物业管理,物业管理,房地产,房地产开发,住宅开发,-,北京市朝阳区北辰东路8号,-,Beijing North Star Company Limited,物业管理；出租写字间、公寓、客房；住宿服务；房地产开发、建设、物业购置及商品房销售；承接国际国内会议、出租展览场地及设施、提供会务服务，出租出售批发零售商业用、餐饮娱乐业用场地及设施；餐饮服务、文体娱乐服务（国家禁止的项目除外）；机械电器设备、激光、电子方面的技术开发、技术服务、技术转让，设备安装，机械设备、清洗设备维修，日用品修理，美容美发，浴池服务，摄录像服务，打字、复印类商务服务，仓储服务，信息咨询；商业零售（包括代销、寄售）：百货、针纺织品、五金交电、金银首饰、家具、字画、副食品、食品、粮油食品、汽车配件、宠物食品、电子计算机、公开发行的国内版电子出版物、计生用品、防盗保险柜、摩托车、西药制剂、中成药、医疗器械；刻字服务；修理钟表、家用电器；验光配镜服务；饮食服务；健康咨询；机动车公共停车场；承办展览展示活动；设备租赁；公司礼仪服务；游泳；体育场馆管理；技术服务；组织文化艺术交流活动；文化艺术咨询；互联网信息服务；以下限分支机构经营：出租、零售音像磁带制品、图书、期刊、电子出版物；零售卷烟、雪茄烟；服装加工。（市场主体依法自主选择经营项目，开展经营活动；“互联网信息服务”、“游泳”以及依法须经批准的项目，经相关部门批准后依批准的内容开展经营活动；不得从事国家和本市产业政策禁止和限制类项目的经营活动。）
中交地产股份有限公司,SZ000736,中交地产股份有限公司,存续,69543.3689万元人民币,4,2022年报,北京市西城区德胜门外大街13号院1号楼合生财富广场12层,915000002028133840,L(大型),1993-02-03,重庆市,重庆市,江北区,zhangyaxin@cccgrealeatate.com,zhangyaxin@cccgrealestate.com;zhangyaxin@zfrealestate.com,500000000006873,增值税一般纳税人,股份有限公司（上市公司）,房地产业,房地产业,房地产开发经营,房地产开发经营,房地产,房地产开发,住宅开发,-,重庆市江北区观音桥建新北路86号,"中房地产股份有限公司,
中房重实地产股份有限公司,
重庆国际实业投资股份有限公司",CCCG Real Estate Corporation Limited,"一般项目：从事房地产开发经营业务，实业投资,物业管理,高科技开发,设备租赁,代理各类商品及技术的进出口业务（国家限定公司经营或禁止进出口的商品及技术除外）,国际经济技术合作的往来函调查及咨询服务;销售矿产品（不含国家规定产品）,化工产品、建筑材料、装饰材料（以上不含危险化学品）,汽车（不含九座及九座以下乘用车）,摩托车及零部件,五金,交电,木材,钢材,日用百货,纺织品,工艺美术品（不含金银饰品）.中小型水、火力发电成套设备的开发、制造、销售及技术咨询服务（国家有专项管理规定的除外）。（除依法须经批准的项目外，凭营业执照依法自主开展经营活动）"
江苏凤凰置业投资股份有限公司,SH600716,江苏凤凰置业投资股份有限公司,在业,93606.059万元人民币,26,2022年报,-,91320000104363033C,S(小型),1996-06-24,江苏省,南京市,鼓楼区,fhzy@ppm.cn,ykai666@126.com,320000000108232,增值税一般纳税人,股份有限公司（上市）,金融业,资本市场服务,其他资本市场服务,其他资本市场服务,房地产,房地产开发,住宅开发,-,南京市中央路389号凤凰国际大厦六楼,秦皇岛耀华玻璃股份有限公司,Jiangsu Phoenix Property Investment Company Limited,房地产投资，实业投资，房屋租赁，物业管理。（依法须经批准的项目，经相关部门批准后方可开展经营活动）
湖北福星科技股份有限公司,SZ000926,湖北福星科技股份有限公司,存续,113847.5688万元人民币,4,2022年报,湖北省武汉市江汉区新华路186号福星国际商会大厦27楼,914200007069595043,L(大型),1993-06-08,湖北省,孝感市,汉川市,fxjtbgs808@126.com,fxkj0926@chinafxkj.com;fxkj926@chinafxkj.com;china-fxst@263.net,420000000029014,增值税一般纳税人,股份有限公司（上市、外商投资企业投资）,房地产业,房地产业,房地产租赁经营,房地产租赁经营,房地产,房地产开发,住宅开发,-,湖北省汉川市沉湖镇福星街1号,湖北省汉川钢丝绳股份有限公司,"HuBei Fuxing Science and Technology Co., Ltd.",房地产开发、经营、管理；物业管理及租赁；高新技术的开发与高新技术项目投资。（涉及许可经营项目，应取得相关部门许可后方可经营）
上海市北高新股份有限公司,SH600604,上海市北高新股份有限公司,存续,187330.4804万元人民币,98,2022年报,上海市江场三路262号,913100006072255050,L(大型),1993-11-10,上海市,上海市,静安区,zhengquan@shibei.com,-,310000400065302,增值税一般纳税人,股份有限公司（台港澳与境内合资、上市）,租赁和商务服务业,商务服务业,咨询与调查,其他专业咨询与调查,房地产,房地产开发,产业地产,-,上海市静安区共和新路3088弄2号1008室,上海二纺机股份有限公司,"Shanghai Shibei Hi-tech Co., Ltd.",企业管理咨询，投资管理咨询，商务信息咨询，会展服务（主办、承办除外），建筑规划方案咨询；物业管理；建筑装饰材料的批发、佣金代理（拍卖除外）（不涉及国营贸易管理商品，涉及配额、许可证管理商品的，按国家有关规定办理申请）。【依法须经批准的项目，经相关部门批准后方可开展经营活动】
四川蓝光发展股份有限公司,SH600466,四川蓝光发展股份有限公司,存续,303493.0435万元人民币,1,2022年报,-,915101007092429550,L(大型),1993-05-18,四川省,成都市,郫都区,crm@brc.com.cn,313832917@qq.com;wujianwen@brc.com.cn,510109000056757,增值税一般纳税人,其他股份有限公司（非上市）,租赁和商务服务业,商务服务业,组织管理服务,其他组织管理服务,房地产,房地产开发,住宅开发,-,成都高新区（西区）西芯大道9号,四川迪康科技药业股份有限公司,"Sichuan Languang Development Co., Ltd.",投资及投资管理；企业策划、咨询服务；企业管理；房地产投资；房地产开发经营；土地整理；商业资产投资、经营；自有房屋租赁；资产管理；物业管理；生物科技技术产品研究、开发、生产（限分支机构在工业园区内经营）；技术咨询服务和技术转让；技术及货物进出口业务（国家禁止或涉及行政审批的货物和技术进出口除外）；电子商务（依法须经批准的项目，经相关部门批准后方可开展经营活动）。
天津津投城市开发股份有限公司,SH600322,天津市房地产发展(集团)股份有限公司,存续,110570万元人民币,140,2022年报,-,91120000103064779N,L(大型),1993-02-25,天津市,天津市,和平区,tffz@sina.com,-,120000000001594,增值税一般纳税人,股份有限公司（上市）,房地产业,房地产业,房地产开发经营,房地产开发经营,房地产,房地产开发,住宅开发,-,和平区常德道80号,天津市房地产发展（集团）股份有限公司,"Tianjin Jintou Urban Development Co., Ltd.",房地产开发及商品房销售、自有房屋租赁、房地产信息咨询、中介服务；商品房代理销售；房屋置换；以下限分支机构经营：物业管理；建筑设计、咨询；金属材料、建筑材料批发；工程项目管理及咨询服务（以上经营范围涉及行业许可的凭许可证件，在有效期内经营，国家有专项专营规定的按规定办理）。
绿景控股股份有限公司,SZ000502,绿景控股股份有限公司,在业,18481.9607万元人民币,13,2022年报,-,91440000201285073K,M(中型),1989-09-18,广东省,广州市,海珠区,lvj@000502.cn,-,440000000006561,-,股份有限公司（上市、自然人投资或控股）,租赁和商务服务业,商务服务业,组织管理服务,投资与资产管理,房地产,房地产服务,物业管理,-,广东省广州市海珠区同福西路131-133号首层01房,"绿景地产股份有限公司,
恒大地产股份有限公司,
海南新能源股份有限公司","Lvjing Holding Co., Ltd.",一般项目：以自有资金从事投资活动；自有资金投资的资产管理服务；信息系统集成服务；信息技术咨询服务；技术服务、技术开发、技术咨询、技术交流、技术转让、技术推广；数据处理和存储支持服务；工业互联网数据服务；数据处理服务；信息系统运行维护服务；网络技术服务；云计算装备技术服务；物联网应用服务；物联网技术服务；电子、机械设备维护（不含特种设备）。（除依法须经批准的项目外，凭营业执照依法自主开展经营活动）许可项目：第一类增值电信业务；互联网信息服务；建筑智能化系统设计；安全系统监控服务。（依法须经批准的项目，经相关部门批准后方可开展经营活动，具体经营项目以相关部门批准文件或许可证件为准）
深圳经济特区房地产（集团）股份有限公司,SZ000029,深圳经济特区房地产(集团)股份有限公司,存续,101166万元人民币,-,-,深圳市光明区新湖街道新羌社区新陂头南2号602。,91440300192179585N,M(中型),1986-07-19,广东省,深圳市,罗湖区,xiexg603@163.com,spg@163.com,440301103225878,一般纳税人,上市股份有限公司,房地产业,房地产业,房地产开发经营,房地产开发经营,房地产,房地产开发,住宅开发,-,深圳市罗湖区南湖街道嘉北社区人民南路3005号深房广场A46层-A48层B46层-B48层,"深圳经济特区房地产总公司,
深圳经济特区房地产公司","Shenzhen Special Economic Zone Real Estate&Properties (Group). Co., Ltd.",一般经营项目是:房地产开发及商品房销售;进出口业务（按深府办[1994] 254号文及深贸发局深贸管审证字第 140号审定证书规定办）;楼宇管理、租赁、建筑设计。
深圳市中洲投资控股股份有限公司,SZ000042,深圳市中洲投资控股股份有限公司,存续,66483.1139万元人民币,0,2022年报,-,91440300192190768P,L(大型),1984-09-17,广东省,深圳市,福田区,121666636@qq.com,zzkg@zztzkg.com;dongshihui@zztzkg.com,440301103813177,一般纳税人,股份有限公司（上市）,房地产业,房地产业,房地产开发经营,房地产开发经营,房地产,房地产开发,住宅开发,-,深圳市福田区福田街道岗厦社区金田路3088号中洲大厦3802,"深圳市长城投资控股股份有限公司,
深圳市长城地产（集团）股份有限公司,
深圳市长城地产股份有限公司,
深圳市长城房地产发展公司,
深圳市工程开发公司","Shenzhen Centralcon Investment Holding Co., Ltd.",一般经营项目是：房地产开发及商品房的销售、管理；承接建筑安装工程；自有物业租赁。
天津津滨发展股份有限公司,SZ000897,天津津滨发展股份有限公司,存续,161727.2234万元人民币,-,-,天津市南开区苍穹道15号,91120000712830811X,L(大型),1998-12-31,天津市,天津市,滨海新区,mayue@jbdc.com.cn,office@jbdc.com.cn,120000000005860,增值税一般纳税人,股份有限公司（上市）,批发和零售业,批发业,其他批发业,其他未列明批发业,房地产,房地产开发,住宅开发,-,天津开发区明园路2号B2别墅5号,-,"Tianjin Jinbin Development Co., Ltd.",房地产开发；食品销售（凭许可证开展经营活动）；自营或代理货物及技术的进出口。法律、法规、国务院决定禁止的，不得经营；应经审批的，未获批准前不得经营；法律、法规、国务院决定未规定审批的，自主经营。（依法须经批准的项目，经相关部门批准后方可开展经营活动）
深圳市天健（集团）股份有限公司,SZ000090,深圳市天健(集团)股份有限公司,存续,186854.5434万元人民币,0,2022年报,-,91440300192251874W,L(大型),1993-12-06,广东省,深圳市,福田区,yangyuanyuan@tagen.cn,zhangaihua@tagen.cn;info@tagen.cn;info@tagn.cn,440301102748199,一般纳税人,上市股份有限公司,租赁和商务服务业,商务服务业,其他商务服务业,其他未列明商务服务业,房地产,房地产开发,住宅开发,-,深圳市福田区莲花街道紫荆社区红荔路7019号天健商务大厦19楼,深圳市天健实业股份有限公司,"Shenzhen Tagen Group Co., Ltd.",一般经营项目是：投资兴办工业实业（具体项目另行申报）；国内商业、物资供销业（不含专营、专卖、专控商品）；开展对外经济技术合作业务（按中华人民共和国对外贸易经济合作部[2000]外经贸发展审函字第913号文规定办理）；自有物业租赁。（除依法须经批准的项目外，凭营业执照依法自主开展经营活动），许可经营项目是：房地产开发经营。（依法须经批准的项目，经相关部门批准后方可开展经营活动，具体经营项目以相关部门批准文件或许可证件为准）
财信地产发展集团股份有限公司,SZ000838,财信地产发展集团股份有限公司,存续,110046.217万元人民币,0,2022年报,重庆市江北区红黄路1号26楼,911100002051092291,L(大型),1996-10-29,重庆市,重庆市,江北区,Casin@casindev.com,zhixin@casindev.com,500000011291272,增值税一般纳税人,股份有限公司（上市公司）,房地产业,房地产业,房地产开发经营,房地产开发经营,房地产,房地产开发,住宅开发,-,重庆市江北区红黄路1号1幢24楼,"财信国兴地产发展股份有限公司,
国兴融达地产股份有限公司,
蓝星石化科技股份有限公司,
西南化机股份有限公司","CASIN Real Estate Development Group Co., Ltd.",一般项目：房地产开发；销售自行开发的商品房；污染治理设施运营；工程和技术研究。（企业依法自主选择经营项目，开展经营活动；依法须经批准的项目，经相关部门批准后依批准的内容开展经营活动；不得从事本市产业政策禁止和限制类项目的经营活动。）（除依法须经批准的项目外，凭营业执照依法自主开展经营活动）
